{"$schema":"https://json-schema.org/draft/2020-12/schema","additionalProperties":false,"properties":{"bundle_a":{"additionalProperties":false,"properties":{"bytes":{"const":114746920},"ciphertext_sha256":{"const":"8d2026d97ffef00666a708e00460a7c11aad48535e900e5be42af77ea462e4b2"},"state":{"const":"encrypted-local"}},"required":["bytes","ciphertext_sha256","state"],"type":"object"},"bundle_b":{"additionalProperties":false,"properties":{"bytes":{"const":114746920},"ciphertext_sha256":{"const":"ac648bc28652d72811bb1496a865702863a447c9c6323758461cd91e9787c17d"},"state":{"const":"encrypted-local-unpublished"}},"required":["bytes","ciphertext_sha256","state"],"type":"object"},"build_commit":{"const":"414f788b6ab85a6c8ccc6bd42d239c808e72cf7c"},"build_verified_at":{"const":"2026-09-19T04:24:56Z"},"event":{"const":"separately-authorized-live-build"},"host_cleanup":{"additionalProperties":false,"properties":{"cleanup_units_absent":{"const":true},"workspace_absent":{"const":true},"writer_units_inactive_successful":{"const":true}},"required":["cleanup_units_absent","workspace_absent","writer_units_inactive_successful"],"type":"object"},"metadata_sha256":{"const":"bd5bf9e21da50e0e36b1cb38b5714db513d36626c5318169bb74e75877a2dad8"},"observation":{"additionalProperties":false,"properties":{"age_seconds":{"const":58532},"observed_at":{"const":"2026-09-19T04:22:05Z"},"sha256":{"const":"e7bf314b36551b04d3ed3b8a7752020710d966d977c73b15327ba50334832754"},"snapshot_time":{"const":"2026-09-18T12:06:33.818821Z"}},"required":["age_seconds","observed_at","sha256","snapshot_time"],"type":"object"},"plaintext_sha256":{"const":"1ad80df3f3c7706004e995d40e3d7b6078d85ddbd667a92ba08d52a007547507"},"recipient_sha256":{"const":"492589a8d4a4a0670834f2d5ad9d6ef000186e66171d10d72740b9b30f20cbbf"},"repository_id":{"const":"dce8dbc3cde106047631317a09257c23ee5eab4d9ece5f88d52108ae384a8503"},"scope":{"additionalProperties":false,"properties":{"aws_contacted":{"const":false},"bundle_decrypted":{"const":false},"publication_performed":{"const":false},"restore_performed":{"const":false}},"required":["aws_contacted","bundle_decrypted","publication_performed","restore_performed"],"type":"object"},"snapshots":{"additionalProperties":false,"properties":{"games":{"const":"50c0a57fe0fe5df34dce465d641dedb2f202c1886b99d909b7aca3408f4d1e9b"},"nfs":{"const":"22d0601caeeca059533af4c71f927b4ac8d9a3dd01d337d137be568f260682eb"},"proton":{"const":"9ac6ef90f30c87326fb73788e95f9de86fac4c01c421ab63e14b667a9b58f3fc"}},"required":["games","nfs","proton"],"type":"object"},"state":{"const":"built-verified-local"},"version":{"const":1}},"required":["bundle_a","bundle_b","build_commit","build_verified_at","event","host_cleanup","metadata_sha256","observation","plaintext_sha256","recipient_sha256","repository_id","scope","snapshots","state","version"],"type":"object"}
