{"bundle_a":{"bytes":114746920,"ciphertext_sha256":"8d2026d97ffef00666a708e00460a7c11aad48535e900e5be42af77ea462e4b2","state":"encrypted-local"},"bundle_b":{"bytes":114746920,"ciphertext_sha256":"ac648bc28652d72811bb1496a865702863a447c9c6323758461cd91e9787c17d","state":"encrypted-local-unpublished"},"build_commit":"414f788b6ab85a6c8ccc6bd42d239c808e72cf7c","build_verified_at":"2026-09-19T04:24:56Z","event":"separately-authorized-live-build","host_cleanup":{"cleanup_units_absent":true,"writer_units_inactive_successful":true,"workspace_absent":true},"metadata_sha256":"bd5bf9e21da50e0e36b1cb38b5714db513d36626c5318169bb74e75877a2dad8","observation":{"age_seconds":58532,"observed_at":"2026-09-19T04:22:05Z","sha256":"e7bf314b36551b04d3ed3b8a7752020710d966d977c73b15327ba50334832754","snapshot_time":"2026-09-18T12:06:33.818821Z"},"plaintext_sha256":"1ad80df3f3c7706004e995d40e3d7b6078d85ddbd667a92ba08d52a007547507","recipient_sha256":"492589a8d4a4a0670834f2d5ad9d6ef000186e66171d10d72740b9b30f20cbbf","repository_id":"dce8dbc3cde106047631317a09257c23ee5eab4d9ece5f88d52108ae384a8503","scope":{"aws_contacted":false,"bundle_decrypted":false,"publication_performed":false,"restore_performed":false},"snapshots":{"games":"50c0a57fe0fe5df34dce465d641dedb2f202c1886b99d909b7aca3408f4d1e9b","nfs":"22d0601caeeca059533af4c71f927b4ac8d9a3dd01d337d137be568f260682eb","proton":"9ac6ef90f30c87326fb73788e95f9de86fac4c01c421ab63e14b667a9b58f3fc"},"state":"built-verified-local","version":1}
